{
  "slug": "marcha-popular-ademco-2026",
  "tenant": "club-ademco",
  "nombre": "XIX Marcha Popular Ademco 2026",
  "nombreCorto": "Marcha Ademco",
  "edicion": 19,
  "deporte": "marcha",
  "competitivo": false,
  "fecha": "2026-09-27",
  "fechaTexto": "Domingo 27 de septiembre de 2026",
  "lugar": {
    "nombre": "Colindres",
    "municipio": "Colindres",
    "provincia": "Cantabria"
  },
  "organizador": {
    "nombre": "Club Ademco Colindres",
    "web": "https://www.ademco-club.com",
    "email": "club.ademco@gmail.com",
    "telefono": "606 76 70 71"
  },
  "estado": "abierta",
  "inscripcion": {
    "cierre": "2026-09-26T23:59:00+02:00",
    "cierreTexto": "26 de septiembre (online); también el día de la marcha",
    "plazasDisponibles": null,
    "modalidades": [
      "individual",
      "presencial"
    ],
    "tarifas": [
      {
        "id": "online",
        "nombre": "Inscripción online",
        "pruebas": [
          "R6",
          "R12",
          "R20"
        ],
        "periodos": [
          {
            "hasta": "2026-09-26",
            "precio": 12
          }
        ],
        "destacada": true
      },
      {
        "id": "online-menor",
        "nombre": "Menores de 12 años",
        "pruebas": [
          "R6",
          "R12",
          "R20"
        ],
        "periodos": [
          {
            "hasta": "2026-09-26",
            "precio": 6.8
          }
        ],
        "condicion": {
          "edadMax": 11
        }
      },
      {
        "id": "dia-adulto",
        "nombre": "El día de la marcha",
        "pruebas": [
          "R6",
          "R12",
          "R20"
        ],
        "modalidad": "presencial",
        "periodos": [
          {
            "desde": "2026-09-27",
            "hasta": "2026-09-27",
            "precio": 15
          }
        ]
      },
      {
        "id": "dia-menor",
        "nombre": "El día de la marcha, menores de 12",
        "pruebas": [
          "R6",
          "R12",
          "R20"
        ],
        "modalidad": "presencial",
        "periodos": [
          {
            "desde": "2026-09-27",
            "hasta": "2026-09-27",
            "precio": 8
          }
        ],
        "condicion": {
          "edadMax": 11
        }
      }
    ],
    "descuentos": [
      {
        "tipo": "online",
        "porcentaje": 15,
        "texto": "Inscribirse a través de www.uno.es tiene un 15 % de descuento sobre el precio del día de la marcha."
      }
    ],
    "extras": [
      {
        "id": "talla",
        "nombre": "Talla de camiseta técnica",
        "tipo": "talla",
        "precio": 0,
        "opciones": [
          "Infantil 5-6",
          "Infantil 7-8",
          "Infantil 9-11",
          "Infantil 12-14",
          "S",
          "M",
          "L",
          "XL",
          "XXL"
        ],
        "obligatorio": true,
        "limite": 400
      }
    ],
    "campos": [
      {
        "id": "club",
        "etiqueta": "Club",
        "tipo": "texto"
      },
      {
        "id": "menor12",
        "etiqueta": "Menor de 12 años",
        "tipo": "si_no",
        "obligatorio": true
      },
      {
        "id": "acepta-reglamento",
        "etiqueta": "Acepto el reglamento",
        "tipo": "consentimiento",
        "obligatorio": true
      }
    ],
    "menores": {
      "permitido": true,
      "tutor": false
    },
    "incluye": [
      "Camiseta técnica de obsequio a los primeros 400 inscritos"
    ],
    "pasarela": {
      "proveedor": "camberas",
      "url": "https://camberas.com/race/xix-marcha-popular-ademco",
      "metodos": [
        "tarjeta",
        "presencial"
      ]
    }
  },
  "pruebas": [
    {
      "id": "R6",
      "nombre": "Ruta Familiar",
      "tipo": "marcha",
      "competitiva": false,
      "chip": false,
      "distancia": 6000,
      "distanciaTexto": "6 km",
      "desnivelPos": 190,
      "salida": "09:30",
      "plazas": 500,
      "lugarSalida": "Colindres"
    },
    {
      "id": "R12",
      "nombre": "Ruta Popular",
      "tipo": "marcha",
      "competitiva": false,
      "chip": false,
      "distancia": 12000,
      "distanciaTexto": "12 km",
      "desnivelPos": 400,
      "salida": "09:30",
      "plazas": 500,
      "lugarSalida": "Colindres",
      "limite": "10 h"
    },
    {
      "id": "R20",
      "nombre": "Ruta Larga",
      "tipo": "marcha",
      "competitiva": false,
      "chip": false,
      "distancia": 20000,
      "distanciaTexto": "20 km",
      "desnivelPos": 800,
      "salida": "09:30",
      "plazas": 500,
      "lugarSalida": "Colindres",
      "limite": "10 h"
    }
  ],
  "camiseta": {
    "incluida": true,
    "limite": 400,
    "texto": "Obsequio camiseta técnica a los primeros 400 inscritos."
  },
  "contacto": {
    "email": "club.ademco@gmail.com",
    "telefono": "606 76 70 71",
    "redes": {
      "web": "https://www.ademco-club.com",
      "facebook": "https://www.facebook.com/ClubAdemcoColindres/"
    }
  },
  "servicios_tecnicos": {
    "proveedor": "UNO Crono",
    "texto": "Inscripciones"
  },
  "fuente": {
    "origen": "https://uno.es/carreras/marcha-popular-ademco-2026 y su formulario + ficha camberas.com/race/xix-marcha-popular-ademco",
    "fecha": "2026-09-22",
    "pendiente": [
      "punto de encuentro exacto en Colindres",
      "precio online de menores (uno.es no lo desglosa: 6,80 € es el 15 % sobre 8 €)"
    ]
  }
}